{"$schema":"https://json-schema.org/draft/2020-12/schema","$id":"https://jichi-insight.example/schemas/okinawa_midterm_indicator_evidence.schema.json","title":"Okinawa midterm indicator evidence","type":"object","additionalProperties":false,"required":["id","prefecture_code","packet_count","packets","updated_at"],"properties":{"id":{"type":"string","pattern":"^okinawa-midterm-indicator-evidence-part-[1-4]$"},"prefecture_code":{"const":"47"},"packet_count":{"const":94},"packets":{"type":"array","minItems":94,"maxItems":94,"items":{"$ref":"#/$defs/packet"}},"updated_at":{"type":"string","format":"date"}},"$defs":{"claim":{"type":"object","additionalProperties":false,"required":["field","value_original"],"properties":{"field":{"enum":["policy","indicator_name","baseline","target_r9","national_current"]},"value_original":{"type":["string","null"]}}},"packet":{"type":"object","additionalProperties":false,"required":["id","subject_id","source_url","source_pdf_page","source_table_row","claims","review_status"],"properties":{"id":{"type":"string","pattern":"^okinawa-midterm-evidence-[0-9]{3}$"},"subject_id":{"type":"string","pattern":"^okinawa-midterm-indicator-[0-9]{3}$"},"source_url":{"type":"string","format":"uri"},"source_pdf_page":{"type":"integer","minimum":5,"maximum":71},"source_table_row":{"type":"integer","minimum":1},"claims":{"type":"array","minItems":5,"maxItems":5,"items":{"$ref":"#/$defs/claim"}},"review_status":{"const":"reviewed"}}}}}