{"id":"okinawa-midterm-indicator-evidence-part-2","prefecture_code":"47","packet_count":94,"packets":[{"id":"okinawa-midterm-evidence-095","subject_id":"okinawa-midterm-indicator-095","source_url":"https://www.pref.okinawa.jp/_res/projects/default_project/_page_/001/034/436/7_tyukijisshikeikaku_r2.pdf","source_pdf_page":21,"source_table_row":5,"claims":[{"field":"policy","value_original":"２－（２）－ア－① 妊産婦を支える体 制づくり"},{"field":"indicator_name","value_original":"産後ケア事業実施市 町村数"},{"field":"baseline","value_original":"28市町村（68.3％） （R３年度）"},{"field":"target_r9","value_original":"41市町村（100％）"},{"field":"national_current","value_original":"1,360市町村 （78.1％） （R３年度）"}],"review_status":"reviewed"},{"id":"okinawa-midterm-evidence-096","subject_id":"okinawa-midterm-indicator-096","source_url":"https://www.pref.okinawa.jp/_res/projects/default_project/_page_/001/034/436/7_tyukijisshikeikaku_r2.pdf","source_pdf_page":21,"source_table_row":6,"claims":[{"field":"policy","value_original":"２－（２）－ア－② 乳幼児の健康の保 持・増進"},{"field":"indicator_name","value_original":"乳児健康診査の受診 率"},{"field":"baseline","value_original":"89.3％ （R３年度）"},{"field":"target_r9","value_original":"97.0％"},{"field":"national_current","value_original":"87.5％ （R３年度）"}],"review_status":"reviewed"},{"id":"okinawa-midterm-evidence-097","subject_id":"okinawa-midterm-indicator-097","source_url":"https://www.pref.okinawa.jp/_res/projects/default_project/_page_/001/034/436/7_tyukijisshikeikaku_r2.pdf","source_pdf_page":22,"source_table_row":1,"claims":[{"field":"policy","value_original":"２－（２）－ア－③ 乳幼児期の子育て 環境の充実"},{"field":"indicator_name","value_original":"保育所等入所待機児 童数（顕在・潜在）"},{"field":"baseline","value_original":"2,234人 （R４年）"},{"field":"target_r9","value_original":"673人"},{"field":"national_current","value_original":"92,141人 （Ｒ６年）"}],"review_status":"reviewed"},{"id":"okinawa-midterm-evidence-098","subject_id":"okinawa-midterm-indicator-098","source_url":"https://www.pref.okinawa.jp/_res/projects/default_project/_page_/001/034/436/7_tyukijisshikeikaku_r2.pdf","source_pdf_page":22,"source_table_row":2,"claims":[{"field":"policy","value_original":"２－（２）－イ－① 子どもの多様な居 場所づくり"},{"field":"indicator_name","value_original":"小学生数に占める児 童クラブを利用できな かった児童数（待機児 童数）の割合"},{"field":"baseline","value_original":"0.78％ （R３年度）"},{"field":"target_r9","value_original":"0.32％"},{"field":"national_current","value_original":"0.27％ （R５年度） （※全国の待機児童 数を全国の小学生 数で除した数値）"}],"review_status":"reviewed"},{"id":"okinawa-midterm-evidence-099","subject_id":"okinawa-midterm-indicator-099","source_url":"https://www.pref.okinawa.jp/_res/projects/default_project/_page_/001/034/436/7_tyukijisshikeikaku_r2.pdf","source_pdf_page":22,"source_table_row":3,"claims":[{"field":"policy","value_original":"２－（２）－イ－② 困難を有する子ど も・若者やその家族 等への支援"},{"field":"indicator_name","value_original":"子ども・若者支援地域 協議会設置件数"},{"field":"baseline","value_original":"２件 （沖縄県、石垣市） （R３年度）"},{"field":"target_r9","value_original":"５件 （沖縄県、石垣市、 県内市町村）"},{"field":"national_current","value_original":"142件 （設置地域数合計） （R６年度）"}],"review_status":"reviewed"},{"id":"okinawa-midterm-evidence-100","subject_id":"okinawa-midterm-indicator-100","source_url":"https://www.pref.okinawa.jp/_res/projects/default_project/_page_/001/034/436/7_tyukijisshikeikaku_r2.pdf","source_pdf_page":22,"source_table_row":4,"claims":[{"field":"policy","value_original":"２－（２）－イ－③ 要保護児童や児童 虐待に対する取組 の強化"},{"field":"indicator_name","value_original":"地域小規模児童養護 施設数"},{"field":"baseline","value_original":"12施設 （R３年度）"},{"field":"target_r9","value_original":"18施設"},{"field":"national_current","value_original":"607施設 （R５年度）"}],"review_status":"reviewed"},{"id":"okinawa-midterm-evidence-101","subject_id":"okinawa-midterm-indicator-101","source_url":"https://www.pref.okinawa.jp/_res/projects/default_project/_page_/001/034/436/7_tyukijisshikeikaku_r2.pdf","source_pdf_page":22,"source_table_row":5,"claims":[{"field":"policy","value_original":"２－（３）－ア－① 県民一人ひとりの健 康づくり活動の定着"},{"field":"indicator_name","value_original":"健康寿命"},{"field":"baseline","value_original":"男性 71.62年 女性 74.33年 （R４年）"},{"field":"target_r9","value_original":"平均寿命の増加分 を上回る健康寿命 の増加"},{"field":"national_current","value_original":"男性 72.57年 女性 75.45年 （R４年）"}],"review_status":"reviewed"},{"id":"okinawa-midterm-evidence-102","subject_id":"okinawa-midterm-indicator-102","source_url":"https://www.pref.okinawa.jp/_res/projects/default_project/_page_/001/034/436/7_tyukijisshikeikaku_r2.pdf","source_pdf_page":22,"source_table_row":6,"claims":[{"field":"policy","value_original":"２－（３）－ア－② 生活習慣病等の予 防に向けた健康的 な生活の定着"},{"field":"indicator_name","value_original":"20-64歳の年齢調整 死亡率（全死因）"},{"field":"baseline","value_original":"男性 326.7 （差125.0） 女性 149.3 （差 45.8） （R２年）"},{"field":"target_r9","value_original":"20～64歳の年齢調 整死亡率（全死因） の全国一位の都道 府県との差の縮小"},{"field":"national_current","value_original":"男性201.7 女性103.5 （R２年） 全国一位の都道府 県"}],"review_status":"reviewed"},{"id":"okinawa-midterm-evidence-103","subject_id":"okinawa-midterm-indicator-103","source_url":"https://www.pref.okinawa.jp/_res/projects/default_project/_page_/001/034/436/7_tyukijisshikeikaku_r2.pdf","source_pdf_page":23,"source_table_row":1,"claims":[{"field":"policy","value_original":"２－（３）－イ－① 地域医療連携体制 の構築"},{"field":"indicator_name","value_original":"回復期病床数"},{"field":"baseline","value_original":"2,033床 （R３年）"},{"field":"target_r9","value_original":"2,404床"},{"field":"national_current","value_original":"199,496床 （R３年）"}],"review_status":"reviewed"},{"id":"okinawa-midterm-evidence-104","subject_id":"okinawa-midterm-indicator-104","source_url":"https://www.pref.okinawa.jp/_res/projects/default_project/_page_/001/034/436/7_tyukijisshikeikaku_r2.pdf","source_pdf_page":23,"source_table_row":2,"claims":[{"field":"policy","value_original":"２－（３）－イ－② 患者・家族等の支援 体制の充実"},{"field":"indicator_name","value_original":"がん診療拠点病院等 のがん相談支援体制 （①相談支援セン ター、②ピアサポート） に対する認知度"},{"field":"baseline","value_original":"①74.0％ ②43.0％ （H30年度）"},{"field":"target_r9","value_original":"①80.0％ ②47.0％"},{"field":"national_current","value_original":"①66.9％ ②27.5％ （H30年度）"}],"review_status":"reviewed"},{"id":"okinawa-midterm-evidence-105","subject_id":"okinawa-midterm-indicator-105","source_url":"https://www.pref.okinawa.jp/_res/projects/default_project/_page_/001/034/436/7_tyukijisshikeikaku_r2.pdf","source_pdf_page":23,"source_table_row":3,"claims":[{"field":"policy","value_original":"２－（３）－イ－③ 小児・周産期医療提 供体制の充実"},{"field":"indicator_name","value_original":"周産期死亡率（出産 千対）"},{"field":"baseline","value_original":"3.2 （R３年）"},{"field":"target_r9","value_original":"2.4"},{"field":"national_current","value_original":"3.3 （R４年）"}],"review_status":"reviewed"},{"id":"okinawa-midterm-evidence-106","subject_id":"okinawa-midterm-indicator-106","source_url":"https://www.pref.okinawa.jp/_res/projects/default_project/_page_/001/034/436/7_tyukijisshikeikaku_r2.pdf","source_pdf_page":23,"source_table_row":4,"claims":[{"field":"policy","value_original":"２－（３）－イ－④ 公立沖縄北部医療 センターの整備推進"},{"field":"indicator_name","value_original":"公立沖縄北部医療セ ンター整備の進捗率"},{"field":"baseline","value_original":"０％ （R３年度）"},{"field":"target_r9","value_original":"100％"},{"field":"national_current","value_original":"－"}],"review_status":"reviewed"},{"id":"okinawa-midterm-evidence-107","subject_id":"okinawa-midterm-indicator-107","source_url":"https://www.pref.okinawa.jp/_res/projects/default_project/_page_/001/034/436/7_tyukijisshikeikaku_r2.pdf","source_pdf_page":23,"source_table_row":5,"claims":[{"field":"policy","value_original":"２－（３）－ウ－① 離島・へき地医療提 供体制の確保・充実"},{"field":"indicator_name","value_original":"へき地診療所の医療 従事医師数"},{"field":"baseline","value_original":"29人 （R３年度）"},{"field":"target_r9","value_original":"30人"},{"field":"national_current","value_original":"－"}],"review_status":"reviewed"},{"id":"okinawa-midterm-evidence-108","subject_id":"okinawa-midterm-indicator-108","source_url":"https://www.pref.okinawa.jp/_res/projects/default_project/_page_/001/034/436/7_tyukijisshikeikaku_r2.pdf","source_pdf_page":23,"source_table_row":6,"claims":[{"field":"policy","value_original":"２－（３）－ウ－② 救急医療提供体制 の確保・充実"},{"field":"indicator_name","value_original":"救急病院数"},{"field":"baseline","value_original":"26病院 （R４年度）"},{"field":"target_r9","value_original":"30病院"},{"field":"national_current","value_original":"3,955病院 （R５年度）"}],"review_status":"reviewed"},{"id":"okinawa-midterm-evidence-109","subject_id":"okinawa-midterm-indicator-109","source_url":"https://www.pref.okinawa.jp/_res/projects/default_project/_page_/001/034/436/7_tyukijisshikeikaku_r2.pdf","source_pdf_page":24,"source_table_row":1,"claims":[{"field":"policy","value_original":"２－（３）－ウ－③ 災害医療提供体制 の確保・充実"},{"field":"indicator_name","value_original":"災害拠点病院数"},{"field":"baseline","value_original":"13病院 （R３年度）"},{"field":"target_r9","value_original":"13病院"},{"field":"national_current","value_original":"776病院 （R５年度）"}],"review_status":"reviewed"},{"id":"okinawa-midterm-evidence-110","subject_id":"okinawa-midterm-indicator-110","source_url":"https://www.pref.okinawa.jp/_res/projects/default_project/_page_/001/034/436/7_tyukijisshikeikaku_r2.pdf","source_pdf_page":24,"source_table_row":2,"claims":[{"field":"policy","value_original":"２－（３）－エ－① 感染症対策の強化"},{"field":"indicator_name","value_original":"結核罹患率（人口10 万対）"},{"field":"baseline","value_original":"11.9 （R３年）"},{"field":"target_r9","value_original":"6.7"},{"field":"national_current","value_original":"9.2 （R３年）"}],"review_status":"reviewed"},{"id":"okinawa-midterm-evidence-111","subject_id":"okinawa-midterm-indicator-111","source_url":"https://www.pref.okinawa.jp/_res/projects/default_project/_page_/001/034/436/7_tyukijisshikeikaku_r2.pdf","source_pdf_page":24,"source_table_row":3,"claims":[{"field":"policy","value_original":"２－（３）－エ－② 新興・再興感染症拡 大期に備えた医療 提供体制の確保"},{"field":"indicator_name","value_original":"感染管理認定看護師 及び感染症看護専門 看護師数"},{"field":"baseline","value_original":"68人 （R３年）"},{"field":"target_r9","value_original":"68人"},{"field":"national_current","value_original":"3,763人 （